{
  "$id": "http://helldivers-armory.com/schemas/stratagems.json",
  "$schema": "https://json-schema.org/draft/2020-12/schema",
  "title": "Stratagem",
  "description": "A Helldivers 2 stratagem",
  "type": "array",
  "items": {
    "type": "object",
    "required": [
      "model",
      "name",
      "armorPenLevel",
      "class"
    ],
    "properties": {
      "model": {
        "type": "string"
      },
      "name": {
        "type": "string"
      },
      "group": {
        "type": "string",
        "enum": [
          "defensive",
          "offensive",
          "supply"
        ]
      },
      "armorPenLevel": {
        "type": "string",
        "enum": [
          "none",
          "light",
          "medium",
          "heavy",
          "antitank"
        ]
      },
      "class": {
        "description": "The class of the stratagem (e.g. support weapon, turret, etc.)",
        "type": "string",
        "enum": [
          "deployable",
          "eagle",
          "orbital",
          "support weapon",
          "tac pack",
          "vehicle"
        ]
      },
      "input": {
        "description": "The input code used to call down the stratagem",
        "type": "string"
      },
      "tags": {
        "description": "Special properties of the stratagem",
        "type": "array",
        "items": {
          "type": "string"
        },
        "uniqueItems": true
      }
    }
  }
}